snapshot_generated_at,claim_id,snapshot_claim_status,snapshot_bill_id,snapshot_bill_status,snapshot_bill_amount,snapshot_payment_status,snapshot_payment_amount,snapshot_note
2025-05-10T09:00:00Z,CLM-2025-OPS-017,approved,AP-2025-REIM-017,scheduled,1842.36,none,0.00,Conference travel reimbursement pending payment run
2025-05-10T09:00:00Z,CLM-2025-FIN-042,approved,AP-2025-0079,scheduled,15476.30,scheduled,15476.30,Conference software reimbursement carried from old AP inbox
2025-05-10T09:00:00Z,CLM-2025-0080,approved,AP-2025-0110,approved,29532.18,none,0.00,Office supplies claim included on reimbursement candidate list
2025-05-10T09:00:00Z,CLM-2025-0038,approved,AP-2025-0024,approved,29878.38,none,0.00,Partial receipt support still under finance review
2025-05-10T09:00:00Z,CLM-2025-0015,approved,AP-2025-0078,paid,9999.59,cleared,9999.59,Meals reimbursement carried from legacy export
